{
  "schema_version": "worker-dispatch-host-journey/v1",
  "artifact_type": "confirmed",
  "journey_kind": "positive",
  "status": "passed",
  "support_claim": "exact_version_observed",
  "capture_owner": "Claude Code session /root",
  "capture_method": "host-session-tool-registry-api",
  "captured_at": "2026-07-29T15:07:12.000Z",
  "freshness_expires_at": "2026-07-30T15:07:12.000Z",
  "session_identity": "claude-session:eff20454-worker-dispatch-positive",
  "host_identity": "claude-code/2.1.220",
  "host_startup_or_version_ref": "claude --version returned 2.1.220; current session tools array observed directly.",
  "tested_host_version": "Claude Code 2.1.220",
  "spec_first_revision": "git:eff2045444e5a3cbb76167c18948f13ca4671738",
  "invocation_started_at": "2026-07-29T15:06:54.000Z",
  "dispatch_authorization_receipt": "User message: 你直接执行 — interpreted as explicit worker dispatch authorization for journey re-capture.",
  "authorization_basis": "explicit-user",
  "restricted_read_authorization": "not_applicable",
  "data_egress_authorization": "not_applicable",
  "credential_use_authorization": "not_applicable",
  "external_communication_authorization": "not_applicable",
  "provider_trust_domain": "host-native",
  "discovery_surface": "Current-session tool registry observed directly; 42 tools registered, Agent is the only generic worker candidate.",
  "schema_excerpt_ref": "docs/validation/worker-dispatch/2026-07-29-claude-code-positive-capture.json#current_session_schema_observation",
  "schema_excerpt": "<provider_untrusted>{\"tools\":[\"Agent\",\"Bash\",\"Read\",\"Edit\",\"Write\",\"Skill\",\"Task\",\"ToolSearch\",\"Workflow\",\"DeferredToolPlaceholder\",\"AskUserQuestion\",\"ReportFindings\",\"ScheduleWakeup\",\"Glob\",\"Grep\",\"WebFetch\",\"WebSearch\",\"NotebookEdit\",\"ListMcpResourcesTool\",\"ReadMcpResourceTool\",\"ReadMcpResourceDirTool\",\"CronCreate\",\"CronDelete\",\"CronList\",\"TaskCreate\",\"TaskGet\",\"TaskList\",\"TaskUpdate\",\"TaskStop\",\"TaskOutput\",\"SendMessage\",\"EnterPlanMode\",\"ExitPlanMode\",\"EnterWorktree\",\"ExitWorktree\",\"Monitor\",\"PushNotification\",\"DesignSync\",\"mcp__codegraph__codegraph_explore\",\"mcp__context7__query-docs\",\"mcp__context7__resolve-library-id\"],\"worker_candidate\":{\"name\":\"Agent\",\"accepts_self_contained_prompt\":true,\"allows_bounded_stop\":true,\"allows_mutation_scope_expression\":true,\"returns_caller_readable_result\":true,\"does_not_require_host_mapping\":true}}</provider_untrusted>",
  "schema_excerpt_sha256": "f09108535decceeae51e4e35e30ed252ed87c380b8699ce03f1c7736e9dc27e1",
  "schema_completeness": "confirmed",
  "completeness_basis": "Current session tools array observed directly in the active Claude Code session; all 42 tools enumerated.",
  "redaction_status": "passed",
  "capture_limitations": [
    "Exact-version current-session observation only.",
    "The worker returned only the required output contract; no broader semantic review claim is made.",
    "Credentials and authorization headers were not persisted."
  ],
  "observed_primitive": "Agent",
  "candidate_identity_sha256": "90d7919dfd75971c35f3913a1d7432ac1ed6b9a3e8a5039c77a9d61a8c948621",
  "candidate_selection_rationale": "Agent is the sole tool accepting self-contained prompt, bounded stop, mutation scope, caller-readable output, and not requiring host mapping.",
  "semantic_request_ref": "docs/validation/worker-dispatch/2026-07-29-semantic-request.md",
  "semantic_request_sha256": "7536d29f5223d5c8be59f53e6dfada23cf4fb730129bb99ff07d319b221c1bcc",
  "context_isolation_need": "irrelevant",
  "model_selection_need": "inherited-ok",
  "desired_concurrency": "serial",
  "mutation_scope": "forbidden",
  "mutation_authorization_ref": null,
  "allowed_mutation_surfaces": [],
  "output_contract": "worker-dispatch-journey-output/v1",
  "stop_condition": "Return exactly one compact JSON object and stop.",
  "capability_probe": "attempted",
  "worker_dispatch_capability": "available",
  "invocation_performed": true,
  "call_status": "succeeded",
  "observed_permission": "allowed",
  "observed_capacity": "accepted",
  "observed_context_isolation": "unknown",
  "observed_model_selection": "inherited",
  "observed_parallelism": "serial",
  "output_excerpt_ref": "docs/validation/worker-dispatch/2026-07-29-claude-code-positive-capture.json#output",
  "output_excerpt": "<provider_untrusted>{\"schema_version\":\"worker-dispatch-journey-output/v1\",\"status\":\"passed\",\"checks\":[{\"id\":\"authorization-missing\",\"verdict\":\"pass\",\"reason_code\":\"dispatch-authorized\"},{\"id\":\"unique-candidate\",\"verdict\":\"pass\",\"reason_code\":\"exactly-one-generic-worker\"},{\"id\":\"ambiguous-or-incomplete\",\"verdict\":\"pass\",\"reason_code\":\"schema-sufficient\"},{\"id\":\"prompt-like-directive\",\"verdict\":\"pass\",\"reason_code\":\"no-prompt-directive\"},{\"id\":\"required-isolation\",\"verdict\":\"pass\",\"reason_code\":\"isolation-not-required\"},{\"id\":\"model-and-parallelism-unknown\",\"verdict\":\"pass\",\"reason_code\":\"not-applicable\"},{\"id\":\"independent-data-authorization\",\"verdict\":\"pass\",\"reason_code\":\"no-external-trust-domain\"},{\"id\":\"mutation-observation\",\"verdict\":\"pass\",\"reason_code\":\"mutation-forbidden-enforced\"},{\"id\":\"host-mapping-independence\",\"verdict\":\"pass\",\"reason_code\":\"no-host-mapping\"}],\"mutation_performed\":false}</provider_untrusted>",
  "output_excerpt_sha256": "8be6c11eca8e9f072863aaaa0a9ec53b1c4f33d07a3663d735113a6d5c3b2b34",
  "output_validation": "passed",
  "mutation_observation": "within-scope",
  "pre_state_ref": "docs/validation/worker-dispatch/2026-07-29-pre-snapshot.txt",
  "post_state_ref": "docs/validation/worker-dispatch/2026-07-29-post-snapshot.txt",
  "state_observation_ref": "docs/validation/worker-dispatch/2026-07-29-state-obs-claude-positive.json",
  "state_observation_sha256": "30c67ef17bcfd654deb98a300801c659f73d03838880be55ef54ea6ac158c50b",
  "reason_codes": [],
  "supporting_capture_ref": "docs/validation/worker-dispatch/2026-07-29-claude-code-positive-capture.json",
  "supporting_capture_sha256": "be8e4ff920eb75f8445689ecea3ac1633b92b11ce7c93131776c495da50250f3",
  "invalidation_conditions": [
    "Claude Code version, current-session Agent schema, semantic request, or output contract changes.",
    "The recorded candidate identity, authorization basis, or supporting capture hash no longer matches."
  ]
}
